{
  "$schema": "https://json-schema.org/draft/2020-12/schema",
  "$id": "https://raw.githubusercontent.com/safal207/ContractGraph-QA/main/contractgraph_qa/conformance/liminalqa-v0.1/suite.schema.json",
  "title": "ContractGraph-QA and LiminalQA interop conformance suite v0.1",
  "type": "object",
  "required": [
    "schema",
    "suiteId",
    "version",
    "suiteSchema",
    "resultSchema",
    "contracts",
    "cases",
    "claimBoundary"
  ],
  "properties": {
    "schema": {
      "const": "org.contractgraph-qa.liminalqa-interop-conformance-suite.v0.1"
    },
    "suiteId": {
      "$ref": "#/$defs/safeId"
    },
    "version": {
      "const": "0.1.0"
    },
    "suiteSchema": {
      "type": "object",
      "required": ["path", "sha256"],
      "properties": {
        "path": {
          "const": "suite.schema.json"
        },
        "sha256": {
          "$ref": "#/$defs/sha256"
        }
      },
      "additionalProperties": false
    },
    "resultSchema": {
      "type": "object",
      "required": ["path", "sha256"],
      "properties": {
        "path": {
          "const": "result.schema.json"
        },
        "sha256": {
          "$ref": "#/$defs/sha256"
        }
      },
      "additionalProperties": false
    },
    "contracts": {
      "type": "array",
      "minItems": 2,
      "maxItems": 2,
      "items": {
        "$ref": "#/$defs/contract"
      },
      "allOf": [
        {
          "contains": {
            "properties": {
              "artifactSchema": {
                "const": "org.contractgraph-qa.liminalqa-evidence.v0.1"
              }
            },
            "required": ["artifactSchema"]
          },
          "minContains": 1,
          "maxContains": 1
        },
        {
          "contains": {
            "properties": {
              "artifactSchema": {
                "const": "org.liminalqa.cgqa-candidates.v0.1"
              }
            },
            "required": ["artifactSchema"]
          },
          "minContains": 1,
          "maxContains": 1
        }
      ]
    },
    "cases": {
      "type": "array",
      "minItems": 14,
      "maxItems": 14,
      "items": {
        "$ref": "#/$defs/case"
      }
    },
    "claimBoundary": {
      "$ref": "#/$defs/nonBlank"
    }
  },
  "additionalProperties": false,
  "$defs": {
    "nonBlank": {
      "type": "string",
      "minLength": 1,
      "pattern": ".*\\S.*"
    },
    "safeId": {
      "type": "string",
      "minLength": 1,
      "maxLength": 200,
      "pattern": "^[A-Za-z0-9][A-Za-z0-9._:-]*$"
    },
    "sha256": {
      "type": "string",
      "pattern": "^[0-9a-f]{64}$"
    },
    "commitSha": {
      "type": "string",
      "pattern": "^[0-9a-f]{40}$"
    },
    "relativeJsonPath": {
      "type": "string",
      "pattern": "^(?!/)(?!.*(?:^|/)\\.\\.(?:/|$)).+\\.json$"
    },
    "contract": {
      "type": "object",
      "required": [
        "id",
        "artifactSchema",
        "artifactProfile",
        "ownerRepository",
        "producerCommit",
        "schemaPath",
        "schemaSha256",
        "fixturePath",
        "fixtureSha256"
      ],
      "properties": {
        "id": {
          "$ref": "#/$defs/safeId"
        },
        "artifactSchema": {
          "enum": [
            "org.contractgraph-qa.liminalqa-evidence.v0.1",
            "org.liminalqa.cgqa-candidates.v0.1"
          ]
        },
        "artifactProfile": {
          "$ref": "#/$defs/nonBlank"
        },
        "ownerRepository": {
          "type": "string",
          "pattern": "^[^/\\s]+/[^/\\s]+$"
        },
        "producerCommit": {
          "$ref": "#/$defs/commitSha"
        },
        "schemaPath": {
          "$ref": "#/$defs/relativeJsonPath"
        },
        "schemaSha256": {
          "$ref": "#/$defs/sha256"
        },
        "fixturePath": {
          "$ref": "#/$defs/relativeJsonPath"
        },
        "fixtureSha256": {
          "$ref": "#/$defs/sha256"
        }
      },
      "allOf": [
        {
          "if": {
            "properties": {
              "artifactSchema": {
                "const": "org.contractgraph-qa.liminalqa-evidence.v0.1"
              }
            },
            "required": ["artifactSchema"]
          },
          "then": {
            "properties": {
              "id": {
                "const": "cgqa-evidence"
              },
              "artifactProfile": {
                "const": "org.contractgraph-qa.bounded-invariant-evidence.v0.1"
              },
              "ownerRepository": {
                "const": "safal207/ContractGraph-QA"
              },
              "producerCommit": {
                "const": "bdf7ced074e3a7baf57cf89ac68be9674bd76a02"
              },
              "schemaSha256": {
                "const": "53b0b4a0b1f4d77de26b8be9dbb90006ea0bd30c5cd3960a2f3e7d44d9664184"
              },
              "fixtureSha256": {
                "const": "e1d5a14c5c1b75e2cfffaf87bf526fd61e141a0c5b7828de4f275e9792fda3ce"
              }
            }
          },
          "else": {
            "properties": {
              "id": {
                "const": "liminal-candidates"
              },
              "artifactProfile": {
                "const": "org.liminalqa.non-authoritative-candidate-seeds.v0.1"
              },
              "ownerRepository": {
                "const": "safal207/LiminalQAengineer"
              },
              "producerCommit": {
                "const": "db9c85f678aafd6e28487e0679a9fb6c3ebfb0c3"
              },
              "schemaSha256": {
                "const": "896e32921d41925a976fef5d0ba561a08bd1f2265a08bc9ccf5065a3238a4f60"
              },
              "fixtureSha256": {
                "const": "60b794934959c30f9957d0e54de83d7760ac38b618b0676603d721daa8ef11d3"
              }
            }
          }
        }
      ],
      "additionalProperties": false
    },
    "case": {
      "type": "object",
      "required": [
        "id",
        "contract",
        "category",
        "description",
        "operation",
        "expectedInputSha256",
        "expectedSemantics"
      ],
      "properties": {
        "id": {
          "$ref": "#/$defs/safeId"
        },
        "contract": {
          "$ref": "#/$defs/safeId"
        },
        "category": {
          "enum": [
            "golden",
            "authority_escalation",
            "semantic_mismatch",
            "temporal_inversion",
            "unknown_field",
            "ambiguous_json",
            "verification_weakening",
            "unsafe_identifier"
          ]
        },
        "description": {
          "$ref": "#/$defs/nonBlank"
        },
        "operation": {
          "$ref": "#/$defs/operation"
        },
        "expectedInputSha256": {
          "$ref": "#/$defs/sha256"
        },
        "expectedSemantics": {
          "enum": ["VALID_NON_AUTHORIZING", "INVALID_BLOCKED"]
        }
      },
      "additionalProperties": false
    },
    "operation": {
      "oneOf": [
        {
          "type": "object",
          "required": ["kind"],
          "properties": {
            "kind": {
              "const": "identity"
            }
          },
          "additionalProperties": false
        },
        {
          "type": "object",
          "required": ["kind", "pointer", "value"],
          "properties": {
            "kind": {
              "enum": ["replace", "add"]
            },
            "pointer": {
              "type": "string",
              "pattern": "^/"
            },
            "value": true
          },
          "additionalProperties": false
        },
        {
          "type": "object",
          "required": ["kind", "pointer"],
          "properties": {
            "kind": {
              "const": "remove"
            },
            "pointer": {
              "type": "string",
              "pattern": "^/"
            }
          },
          "additionalProperties": false
        },
        {
          "type": "object",
          "required": ["kind", "key", "value"],
          "properties": {
            "kind": {
              "const": "duplicate_root_key"
            },
            "key": {
              "$ref": "#/$defs/nonBlank"
            },
            "value": true
          },
          "additionalProperties": false
        }
      ]
    }
  }
}
